<?xml version="1.0" encoding="UTF-8"?>
<!--* Custom Generated eGloo Framework Configuration File *-->
<tns:Configuration xmlns:tns="com.egloo.www/eGlooConfiguration" xmlns:xsi="http://www.w3.org/2001/XMLSchema-instance" xsi:schemaLocation="com.egloo.www/eGlooConfiguration ../XML/schemas/eGlooConfiguration.xsd">
  <tns:Applications>
	<!-- Extra Include Paths : These are application root relative -->
    <tns:Component id="ExtraClassPath" displayName="Extra Class Path" override="false" type="path" value="../Common/PHP"/>
    <tns:Option id="customVariable2" displayName="customVariable2" override="true" type="customVariable" value="foo1"/>
    <tns:Option id="customVariable3" displayName="customVariable3" override="true" type="customVariable" value="foo2"/>
	<tns:Option id="AppBuild" displayName="Build" override="false" type="path" value="../BUILD"/>
	<tns:Option id="AppMaintenanceVersion" displayName="Maintenance Version" override="false" type="" value="1"/>
	<tns:Option id="AppMajorVersion" displayName="Major Version" override="false" type="" value="3"/>
	<tns:Option id="AppMinorVersion" displayName="Minor Version" override="false" type="" value="0"/>
  </tns:Applications>
</tns:Configuration>
