<?xml version="1.0" encoding="UTF-8"?>
<!--
    * Standard eGloo Framework Configuration File
    *
    * Copyright 2010 eGloo, LLC
    * 
    * Licensed under the Apache License, Version 2.0 (the "License");
    * you may not use this file except in compliance with the License.
    * You may obtain a copy of the License at
    * 
    *        http://www.apache.org/licenses/LICENSE-2.0
    * 
    * Unless required by applicable law or agreed to in writing, software
    * distributed under the License is distributed on an "AS IS" BASIS,
    * WITHOUT WARRANTIES OR CONDITIONS OF ANY KIND, either express or implied.
    * See the License for the specific language governing permissions and
    * limitations under the License.
    *  
    * @author George Cooper
    * @copyright 2011 eGloo, LLC
    * @license http://www.apache.org/licenses/LICENSE-2.0
    * @package XMLHTTPResponse
    * @version 1.0
-->
<tns:Configuration xmlns:tns="com.egloo.www/eGlooConfiguration" xmlns:xsi="http://www.w3.org/2001/XMLSchema-instance"
    xsi:schemaLocation="com.egloo.www/eGlooConfiguration schemas/eGlooConfiguration.xsd">
    <Applications>
        <Component id="" displayName="" override="" type="" value="" required=""/>
        <Option id="" displayName="" override="" type="" value="" required=""/>
        <Option id="UseDoctrine" displayName="" override="true" type="" value="" required="true"/>
        <Option id="UseSmarty" displayName="" override="true" type="" value="" required="true"/>
    </Applications>
    <Caching>
        <Component id="CachePath" displayName="Cache Path" override="false" type="path" value="" required="true"/>
        <Option id="egCacheEnabled" displayName="eGloo Caching Enabled" override="" type="" value="" required="true"/>
        <Option id="egAPCCacheEnabled" displayName="eGloo APC Caching Enabled" override="" type="" value="" required="true"/>
        <Option id="egFileCacheEnabled" displayName="eGloo File Caching Enabled" override="" type="" value="" required="true"/>
        <Option id="egMemcacheCacheEnabled" displayName="eGloo Memcache Caching Enabled" override="" type="" value="" required="true"/>
    </Caching>
    <Cubes>
        <Component id="CubesPath" displayName="Cubes Path" override="false" type="path" value="" required="true"/>
        <Option id="" displayName="" override="" type="" value="" required=""/>
    </Cubes>
    <Databases>
        <Component id="" displayName="" override="" type="" value="" required=""/>
        <Option id="" displayName="" override="" type="" value="" required=""/>
    </Databases>
    <Documents>
        <Component id="" displayName="" override="" type="" value="" required=""/>
        <Option id="" displayName="" override="" type="" value="" required=""/>
    </Documents>
    <Framework>
        <Component id="FrameworkRootPath" displayName="Framework Root Path" override="false" type="path" value="" required="true"/>
        <Option id="" displayName="" override="" type="" value="" required=""/>
    </Framework>
    <Library>
        <Component id="DoctrinePath" displayName="Doctrine Path" override="false" type="path" value="" required="true"/>
        <Component id="SmartyPath" displayName="Smarty Path" override="false" type="path" value="" required="true"/>
        <Option id="" displayName="" override="" type="" value="" required=""/>
    </Library>
    <Network>
        <Component id="" displayName="" override="" type="" value="" required=""/>
        <Option id="" displayName="" override="" type="" value="" required=""/>
    </Network>
    <Peering>
        <Component id="" displayName="" override="" type="" value="" required=""/>
        <Option id="" displayName="" override="" type="" value="" required=""/>
    </Peering>
    <System>
        <!-- Components -->
        <Component id="ApplicationsPath" displayName="Applications Path" override="false" type="path" value="" required="true"/>
        <Component id="CachePath" displayName="Cache Path" override="false" type="path" value="" required="true"/>
        <Component id="ConfigurationPath" displayName="Configuration Path" override="false" type="path" value="" required="true"/>
        <Component id="CubesPath" displayName="Cubes Path" override="false" type="path" value="" required="true"/>
        <Component id="DoctrinePath" displayName="Doctrine Path" override="false" type="path" value="" required="true"/>
        <Component id="DocumentationPath" displayName="Documentation Path" override="false" type="path" value="" required="true"/>
        <Component id="DocumentRoot" displayName="Document Root" override="false" type="path" value="" required="true"/>
        <Component id="FrameworkRootPath" displayName="Framework Root Path" override="false" type="path" value="" required="true"/>
        <Component id="LoggingPath" displayName="Logging Path" override="false" type="path" value="" required="true"/>
        <Component id="SmartyPath" displayName="Smarty Path" override="false" type="path" value="" required="true"/>

        <!-- Application / Bundle Selection -->
        <Option id="egApplication" displayName="Default System Application" override="true" type="enum" value="eGloo/Default.gloo" required="true"/>
        <Option id="egInterfaceBundle" displayName="Default System Interface Bundle" override="true" type="enum" value="OverlayInterface" required="true"/>

        <!--
        <Option id="egApplication" displayName="Default System Application" override="true" type="enum" value="Demos/PetFood.gloo" required="true"/>
        <Option id="egInterfaceBundle" displayName="Default System Interface Bundle" override="true" type="enum" value="Default" required="true"/>
        <Option id="egApplication" displayName="Default System Application" override="true" type="enum" value="Demos/BookResale.gloo" required="true"/>
        <Option id="egInterfaceBundle" displayName="Default System Interface Bundle" override="true" type="enum" value="Default" required="true"/>
        <Option id="egApplication" displayName="Default System Application" override="true" type="enum" value="Demos/DogOwners.gloo" required="true"/>
        <Option id="egInterfaceBundle" displayName="Default System Interface Bundle" override="true" type="enum" value="Default" required="true"/>
        <Option id="egApplication" displayName="Default System Application" override="true" type="enum" value="Demos/ImageHosting.gloo" required="true"/>
        <Option id="egInterfaceBundle" displayName="Default System Interface Bundle" override="true" type="enum" value="Default" required="true"/>
        -->
        
        <!-- Database Engine -->
        <Option id="egDatabaseEngine" displayName="eGloo Database Engine" override="true" type="enum" value="POSTGRESQL" required="true"/>
        <!-- <Option id="egDatabaseEngine" displayName="eGloo Database Engine" override="true" type="enum" value="MYSQL" required="true"/> -->

        <!-- Deployment -->
        <Option id="egEnvironment" displayName="eGloo Environment" override="true" type="enum" value="DEVELOPMENT" required="true"/>
        
        <!-- Errors -->
        <Option id="egDisplayErrors" displayName="Display Errors" override="true" type="bool" value="TRUE" required="true"/>
        <Option id="egDisplayTraces" displayName="Display Error Traces" override="true" type="bool" value="TRUE" required="true"/>
        
        <!-- Logging -->
        <Option id="egLogLevel" displayName="eGloo Logging Level" override="true" type="enum" value="PRODUCTION" required="true"/>
        
        <!--
        <Option id="egLogLevel" displayName="eGloo Logging Level" override="true" type="enum" value="STAGING" required=""/>
        <Option id="egLogLevel" displayName="eGloo Logging Level" override="true" type="enum" value="DEVELOPMENT" required=""/>
        -->

        <Option id="egLogFormat" displayName="eGloo Log File Format" override="true" type="enum" value="LOG" required="true"/>

        <!-- Rewrite Options /  -->
        <Option id="egRewriteBase" displayName="eGloo Rewrite Base" override="true" type="string" value="/egloo" required="true"/>

        <Option id="UseDoctrine" displayName="" override="true" type="" value="" required="true"/>
        <Option id="UseSmarty" displayName="" override="true" type="" value="" required="true"/>        
    </System>
</tns:Configuration>
